{"acceptance_summary":"Valid conversion and graceful invalid-input handling","approval_event_id":"demo-intent-approved","approved_at":"2026-09-20T04:00:00Z","approved_by":"local-human","constraints":["No promotion in this demonstration"],"created_at":"2026-09-20T04:00:00Z","created_by":"human-demo","intent_id":"I-701","project_id":"human-demo","purpose":"Demonstrate controlled delivery through E7","requirements":[{"requirement_id":"REQ-001","text":"The CLI shall accept a Fahrenheit temperature and output the equivalent Celsius temperature."},{"requirement_id":"REQ-002","text":"Invalid non-numeric input shall return a non-zero exit status and a clear error message."}],"schema_version":1,"source_event_id":"demo-intent-created","status":"APPROVED","title":"Temperature converter","version":1}
